{
  "schema_version": 2,
  "run_id": "run-20261022T120000Z-1a2b3c4d",
  "revision": 7,
  "frozen_at": "2026-10-22T12:00:00Z",
  "frame_id": "map",
  "map": {
    "map_id": "map-5e6f7a8b",
    "revision": 1,
    "frame_id": "map",
    "yaml": "task1/map.yaml",
    "yaml_sha256": "0000000000000000000000000000000000000000000000000000000000000000",
    "image": "task1/map.pgm",
    "image_sha256": "0000000000000000000000000000000000000000000000000000000000000000",
    "resolution_m": 0.05,
    "origin": {
      "x": -2.6,
      "y": -2.6,
      "yaw": 0.0
    },
    "width_cells": 104,
    "height_cells": 104
  },
  "rescue_geometry": {
    "version": "development-v1",
    "source": "development"
  },
  "targets": [
    {
      "target_id": "T1",
      "marker_id": 1,
      "target_type": "normal",
      "marker_pose": {
        "position": {
          "x": 1.3,
          "y": 2.1,
          "z": 0.2
        },
        "orientation": {
          "x": 0.0,
          "y": 0.0,
          "z": 0.7071068,
          "w": 0.7071068
        }
      },
      "marker_yaw_rad": 1.5707963,
      "covariance": [
        0.01,
        0,
        0,
        0,
        0,
        0,
        0,
        0.01,
        0,
        0,
        0,
        0,
        0,
        0,
        0.02,
        0,
        0,
        0,
        0,
        0,
        0,
        0.05,
        0,
        0,
        0,
        0,
        0,
        0,
        0.05,
        0,
        0,
        0,
        0,
        0,
        0,
        0.03
      ],
      "rescue_zones": [
        {
          "index": 0,
          "pose": {
            "position": {
              "x": 1.3,
              "y": 2.6,
              "z": 0.0
            },
            "orientation": {
              "x": 0.0,
              "y": 0.0,
              "z": -0.7071068,
              "w": 0.7071068
            }
          }
        }
      ],
      "observation_count": 4,
      "confidence": 0.94,
      "observed_by": [
        "robot_1",
        "robot_2"
      ],
      "eligible_for_basic_rescue": true
    },
    {
      "target_id": "TC1",
      "marker_id": 10,
      "target_type": "cooperative",
      "marker_pose": {
        "position": {
          "x": 3.0,
          "y": 0.4,
          "z": 0.2
        },
        "orientation": {
          "x": 0.0,
          "y": 0.0,
          "z": 0.0,
          "w": 1.0
        }
      },
      "marker_yaw_rad": 0.0,
      "covariance": [
        0.01,
        0,
        0,
        0,
        0,
        0,
        0,
        0.01,
        0,
        0,
        0,
        0,
        0,
        0,
        0.02,
        0,
        0,
        0,
        0,
        0,
        0,
        0.05,
        0,
        0,
        0,
        0,
        0,
        0,
        0.05,
        0,
        0,
        0,
        0,
        0,
        0,
        0.03
      ],
      "rescue_zones": [
        {
          "index": 0,
          "pose": {
            "position": {
              "x": 3.5,
              "y": 0.1,
              "z": 0.0
            },
            "orientation": {
              "x": 0.0,
              "y": 0.0,
              "z": -1.0,
              "w": 0.0
            }
          }
        },
        {
          "index": 1,
          "pose": {
            "position": {
              "x": 3.5,
              "y": 0.7,
              "z": 0.0
            },
            "orientation": {
              "x": 0.0,
              "y": 0.0,
              "z": -1.0,
              "w": 0.0
            }
          }
        }
      ],
      "observation_count": 6,
      "confidence": 0.9,
      "observed_by": [
        "robot_1"
      ],
      "eligible_for_basic_rescue": true
    }
  ]
}
